{
  "instance": "dev-a",
  "desired_state": "running",
  "provider_state": "running",
  "provision_state": "provisioned",
  "package_state": {
    "docker": {
      "status": "installed",
      "updated_at": "2026-05-18T10:00:00Z"
    },
    "dev-toolchain": {
      "status": "installed",
      "updated_at": "2026-05-18T10:01:00Z"
    }
  },
  "observed_state": {
    "observed_at": "2026-05-18T12:00:00Z",
    "expires_at": "2026-05-18T12:00:30Z",
    "provider_status": "running",
    "provider_status_raw": "Status: running\nIP: 192.168.64.5\nControl: reachable",
    "ip": "192.168.64.5",
    "control_reachable": true,
    "control_summary": "reachable",
    "guest_reachable": null,
    "refresh_error": null
  },
  "operation_history": [
    {
      "id": 1,
      "name": "provider.up",
      "type": "provider",
      "status": "succeeded",
      "at": "2026-05-18T09:00:00Z"
    },
    {
      "id": 2,
      "name": "provider.up",
      "type": "provider",
      "status": "running",
      "at": "2026-05-18T09:00:01Z",
      "error": "exit 1"
    }
  ],
  "last_operation": {
    "id": 2,
    "name": "provider.up",
    "type": "provider",
    "status": "running",
    "at": "2026-05-18T09:00:01Z",
    "error": "exit 1"
  },
  "last_error": "exit 1",
  "created_at": "2026-05-18T08:00:00Z",
  "updated_at": "2026-05-18T12:00:00Z"
}
